{
  "caseId": "case.shoulder.pilot-02",
  "contentHash": "cb79b0a9d59759c6789cf0256db42fe30973e2723ea7fd1cdce9e230c6b64eee",
  "contentRevision": 1,
  "difficulty": "review required",
  "estimatedTime": "not set",
  "evidenceHub": {
    "conditionRecordId": null,
    "evidenceRecordIds": [],
    "pinnedCaseHash": "cb79b0a9d59759c6789cf0256db42fe30973e2723ea7fd1cdce9e230c6b64eee",
    "pinnedCaseRevision": 1,
    "relationshipIds": [],
    "reviewDecisionId": null,
    "unresolvedEvidenceGaps": [
      "No governed Evidence Hub condition record exists for this pilot.",
      "No source citation has been verified into an approved Evidence Hub evidence record."
    ]
  },
  "governance": {
    "authoringStatus": "draft",
    "clinicalReviewStatus": "clinician-review-required",
    "evidenceReviewStatus": "evidence-review-required",
    "knownLimitations": [
      "Selected as a distinct traumatic shoulder presentation with enough extracted material for a structured draft. Grading, test accuracy and return-to-sport claims remain unverified and blocked.",
      "Missing model answers are intentionally not invented."
    ],
    "nextReviewDate": null,
    "publicationDecision": {
      "approvedContentHash": null,
      "approvedRevision": null,
      "rationale": "Mechanically converted pilot; human clinical, evidence and source-clearance review are required.",
      "status": "blocked"
    },
    "reviewDate": null,
    "reviewerRole": null,
    "sourceClearanceStatus": "source-clearance-required",
    "unresolvedIssues": [
      "Clinical reasoning and safety statements require clinician review.",
      "Citations and evidence claims in the legacy source require independent verification.",
      "Source clearance for derivative publication has not been established."
    ]
  },
  "learnerCaseNumber": "Pilot 02",
  "learnerPresentation": {
    "aggravatingFactors": [],
    "easingFactors": [],
    "initialPresentation": "An adult contact-sport participant reports acute pain over the top of the shoulder after landing directly onto it five days earlier. Arm elevation and carrying equipment are difficult, and a visible contour change has been noticed.",
    "stagedDisclosure": []
  },
  "lifecycleState": "draft",
  "neutralTitle": "Shoulder pain after a contact injury",
  "privateDiagnosticIdentity": {
    "associatedConditionId": "acromioclavicular-joint",
    "evidenceHubConditionId": null,
    "internalSourceStationId": "s31",
    "internalTitle": "Legacy pilot s31",
    "likelyDiagnosis": "Acromioclavicular joint injury",
    "privateLearningFocus": [
      "Legacy conversion pilot",
      "Clinical reasoning structure"
    ]
  },
  "provenance": {
    "aiAssisted": true,
    "citationReferenceIds": [],
    "extractionDate": null,
    "humanEdited": false,
    "legacySourceId": "legacy-html-case-bank-v1",
    "sourceRecordIds": [
      "s31"
    ],
    "sourceRevisionOrHash": "15a168922d97045d4b2e61c756233d9c7edf1398e7d1ad9d05ecd0fe49a18bdd",
    "sourceType": "legacy-html-case-bank",
    "transformationHistory": [
      {
        "action": "personal-identifier-redaction",
        "detail": "Removed the source display name and retained only clinically relevant anonymised attributes.",
        "reviewRequired": true
      },
      {
        "action": "structured-draft-conversion",
        "detail": "Mapped source-supported presentation facts into the governed draft structure without filling evidence gaps.",
        "reviewRequired": true
      }
    ]
  },
  "publicationEligibility": false,
  "publicSlug": "pilot-02-shoulder-pain-after-contact",
  "reasoningStages": [
    {
      "commonPitfalls": [],
      "expectedReasoningThemes": [],
      "feedback": "Source-supported model reasoning has not yet been clinically and evidentially reviewed.",
      "humanReviewRequired": true,
      "id": "initial-hypothesis",
      "learnerQuestion": "What structures and injury patterns should be considered from the mechanism and symptom location?",
      "modelReasoningChecklist": [],
      "order": 1,
      "revealState": "public-after-reveal",
      "type": "initial-hypothesis"
    },
    {
      "commonPitfalls": [],
      "expectedReasoningThemes": [],
      "feedback": "Source-supported model reasoning has not yet been clinically and evidentially reviewed.",
      "humanReviewRequired": true,
      "id": "differential-diagnosis",
      "learnerQuestion": "Which alternative traumatic shoulder presentations need to be excluded?",
      "modelReasoningChecklist": [],
      "order": 2,
      "revealState": "public-after-reveal",
      "type": "differential-diagnosis"
    },
    {
      "commonPitfalls": [],
      "expectedReasoningThemes": [],
      "feedback": "Source-supported model reasoning has not yet been clinically and evidentially reviewed.",
      "humanReviewRequired": true,
      "id": "red-flag-escalation",
      "learnerQuestion": "Which neurovascular and fracture-related findings would change the urgency of assessment?",
      "modelReasoningChecklist": [],
      "order": 3,
      "revealState": "public-after-reveal",
      "type": "red-flag-escalation"
    },
    {
      "commonPitfalls": [],
      "expectedReasoningThemes": [],
      "feedback": "Source-supported model reasoning has not yet been clinically and evidentially reviewed.",
      "humanReviewRequired": true,
      "id": "objective-assessment",
      "learnerQuestion": "How would you structure a safe objective assessment and interpret instability without over-grading the injury?",
      "modelReasoningChecklist": [],
      "order": 4,
      "revealState": "public-after-reveal",
      "type": "objective-assessment"
    },
    {
      "commonPitfalls": [],
      "expectedReasoningThemes": [],
      "feedback": "Source-supported model reasoning has not yet been clinically and evidentially reviewed.",
      "humanReviewRequired": true,
      "id": "referral-threshold",
      "learnerQuestion": "What additional information is needed before discussing referral or return to contact activity?",
      "modelReasoningChecklist": [],
      "order": 5,
      "revealState": "public-after-reveal",
      "type": "referral-threshold"
    }
  ],
  "region": "shoulder",
  "schemaVersion": 2
}
