{
  "caseId": "case.cervical.pilot-01",
  "contentHash": "9bf7c2d987931c0d3c61be7c8e4f9e08a10c8539bdd552f05156853db04b0ce0",
  "contentRevision": 1,
  "difficulty": "review required",
  "estimatedTime": "not set",
  "evidenceHub": {
    "conditionRecordId": null,
    "evidenceRecordIds": [],
    "pinnedCaseHash": "9bf7c2d987931c0d3c61be7c8e4f9e08a10c8539bdd552f05156853db04b0ce0",
    "pinnedCaseRevision": 1,
    "relationshipIds": [],
    "reviewDecisionId": null,
    "unresolvedEvidenceGaps": [
      "No governed Evidence Hub condition record exists for this pilot.",
      "No source citation has been verified into an approved Evidence Hub evidence record."
    ]
  },
  "governance": {
    "authoringStatus": "draft",
    "clinicalReviewStatus": "clinician-review-required",
    "evidenceReviewStatus": "evidence-review-required",
    "knownLimitations": [
      "Selected because the extracted station contains a coherent history, examination, safety screen and competing hypotheses. The draft remains blocked because the clinical claims and cited measures require verification.",
      "Missing model answers are intentionally not invented."
    ],
    "nextReviewDate": null,
    "publicationDecision": {
      "approvedContentHash": null,
      "approvedRevision": null,
      "rationale": "Mechanically converted pilot; human clinical, evidence and source-clearance review are required.",
      "status": "blocked"
    },
    "reviewDate": null,
    "reviewerRole": null,
    "sourceClearanceStatus": "source-clearance-required",
    "unresolvedIssues": [
      "Clinical reasoning and safety statements require clinician review.",
      "Citations and evidence claims in the legacy source require independent verification.",
      "Source clearance for derivative publication has not been established."
    ]
  },
  "learnerCaseNumber": "Pilot 01",
  "learnerPresentation": {
    "aggravatingFactors": [],
    "easingFactors": [],
    "initialPresentation": "An adult recreational runner reports a six-month history of unilateral headache beginning in the upper neck and extending toward the temple. Symptoms are associated with sustained desk posture and long drives, settle with movement, and are affecting preparation for a planned running event.",
    "stagedDisclosure": []
  },
  "lifecycleState": "draft",
  "neutralTitle": "Unilateral headache with neck-related features",
  "privateDiagnosticIdentity": {
    "associatedConditionId": "cervicogenic-headache",
    "evidenceHubConditionId": null,
    "internalSourceStationId": "s27",
    "internalTitle": "Legacy pilot s27",
    "likelyDiagnosis": "Cervicogenic headache",
    "privateLearningFocus": [
      "Legacy conversion pilot",
      "Clinical reasoning structure"
    ]
  },
  "provenance": {
    "aiAssisted": true,
    "citationReferenceIds": [],
    "extractionDate": null,
    "humanEdited": false,
    "legacySourceId": "legacy-html-case-bank-v1",
    "sourceRecordIds": [
      "s27"
    ],
    "sourceRevisionOrHash": "2fafeba31702c8c27b2b99f0636ca248fc7ccd3ae625ffc3fa623ee79e0ffa89",
    "sourceType": "legacy-html-case-bank",
    "transformationHistory": [
      {
        "action": "personal-identifier-redaction",
        "detail": "Removed the source display name and retained only clinically relevant anonymised attributes.",
        "reviewRequired": true
      },
      {
        "action": "structured-draft-conversion",
        "detail": "Mapped source-supported presentation facts into the governed draft structure without filling evidence gaps.",
        "reviewRequired": true
      }
    ]
  },
  "publicationEligibility": false,
  "publicSlug": "pilot-01-unilateral-headache-with-neck-features",
  "reasoningStages": [
    {
      "commonPitfalls": [],
      "expectedReasoningThemes": [],
      "feedback": "Source-supported model reasoning has not yet been clinically and evidentially reviewed.",
      "humanReviewRequired": true,
      "id": "initial-hypothesis",
      "learnerQuestion": "Which broad hypotheses would you consider from this presentation, and what information is still missing?",
      "modelReasoningChecklist": [],
      "order": 1,
      "revealState": "public-after-reveal",
      "type": "initial-hypothesis"
    },
    {
      "commonPitfalls": [],
      "expectedReasoningThemes": [],
      "feedback": "Source-supported model reasoning has not yet been clinically and evidentially reviewed.",
      "humanReviewRequired": true,
      "id": "differential-diagnosis",
      "learnerQuestion": "Which alternative headache presentations must remain in the differential before considering a neck-related explanation?",
      "modelReasoningChecklist": [],
      "order": 2,
      "revealState": "public-after-reveal",
      "type": "differential-diagnosis"
    },
    {
      "commonPitfalls": [],
      "expectedReasoningThemes": [],
      "feedback": "Source-supported model reasoning has not yet been clinically and evidentially reviewed.",
      "humanReviewRequired": true,
      "id": "red-flag-escalation",
      "learnerQuestion": "What safety screening and escalation questions are required before physical assessment?",
      "modelReasoningChecklist": [],
      "order": 3,
      "revealState": "public-after-reveal",
      "type": "red-flag-escalation"
    },
    {
      "commonPitfalls": [],
      "expectedReasoningThemes": [],
      "feedback": "Source-supported model reasoning has not yet been clinically and evidentially reviewed.",
      "humanReviewRequired": true,
      "id": "objective-assessment",
      "learnerQuestion": "What examination would help test the competing hypotheses without treating one finding as diagnostic in isolation?",
      "modelReasoningChecklist": [],
      "order": 4,
      "revealState": "public-after-reveal",
      "type": "objective-assessment"
    },
    {
      "commonPitfalls": [],
      "expectedReasoningThemes": [],
      "feedback": "Source-supported model reasoning has not yet been clinically and evidentially reviewed.",
      "humanReviewRequired": true,
      "id": "management-reasoning",
      "learnerQuestion": "What information would be needed before proposing a graded activity plan?",
      "modelReasoningChecklist": [],
      "order": 5,
      "revealState": "public-after-reveal",
      "type": "management-reasoning"
    }
  ],
  "region": "cervical",
  "schemaVersion": 2
}
